{
  "name": "ETF",
  "description": "Manage assets in your vault like an ETF.",
  "docs": "https://docs.abstract.money/tutorials/managed-etf",
  "website": "https://abstract.money",
  "type": "app",
  "icon": "RiStockLine",
  "readme": "https://raw.githubusercontent.com/AbstractSDK/abstract/main/modules/contracts/apps/etf/README.md"
}
