{
  "name": "Cw Staking",
  "description": "Stake stake stake",
  "docs": "",
  "website": "https://fortytwo.finance",
  "type": "adapter",
  "icon": "GiTrade",
  "enabled": true,
  "readme": "https://raw.githubusercontent.com/AbstractSDK/abstract/main/modules/contracts/adapters/cw-staking/README.md"
}
